{
  "portal_id": "example-component-review",
  "generated_at": "2026-06-21T00:00:00Z",
  "portal_type": "component",
  "title": "Example Component Review",
  "entries": [
    {
      "name": "PrimaryButton",
      "figma_name": "Button/Primary/Large",
      "type": "component",
      "figma_reference_screenshot": "references/components/button-primary-large.png",
      "runtime_screenshot": "runtime/components/button-primary-large.png",
      "diff_image": "reports/components/button-primary-large.diff.png",
      "status": "ready_for_use",
      "agent_conclusion": "Automatic comparison completed with no blocking difference.",
      "issue_summary": [],
      "report_ref": "reports/components/button-primary-large.json",
      "registry_ref": "component_registry.json#/components/0",
      "traceback_refs": [
        "token_mapping.json#/tokens/0"
      ],
      "requires_human_review": false,
      "human_review_reason": null
    }
  ]
}

